item_id,user_id,region,city,parent_category_name,category_name,param_1,param_2,param_3,title,description,price,item_seq_number,activation_date,user_type,image,image_top_1,deal_probability
dd65da44086c,bf74debfc95a,Волгоградская область,Волгоград,Хобби и отдых,Коллекционирование,"Жетоны, медали, значки",,,Медаль ВАЗ. В честь пуска завода,"Настольная памятная медаль Волжский автомобильный завод им. 50 летия СССР. В честь пуска завода. 1967-1973. Медаль в хорошем состоянии. Выпущена в 1973 г. с хорошим художественным уровнем. Изготовлена из медно-никелевого сплава (вероятно, мельхиор). Диаметр 65 мм, толщина 3 мм (по гурту - 4 мм), гурт гладкий.",800.0,295,2017-03-23,Company,b2cb1b135fba683127b015971a4b8bb3a023180507ff557b3ee5f6de0f7df297,2416.0,0.0
f55eed4e831e,7e8eb4a5d1d5,Калининградская область,Гвардейск,Недвижимость,Коммерческая недвижимость,Продам,Складское помещение,,Склад 70 м²,"Продается склад ГСМ, по адресу п. Истровка, Калининградской обл, Гвардейского района, площадью 70 кв.м, с прилегающей територией 16 сот.",800000.0,6004,2017-03-28,Shop,,,0.06626
eddd320650f3,9250cd567e37,Воронежская область,Воронеж,Личные вещи,"Одежда, обувь, аксессуары",Женская одежда,Обувь,37,Свадебные туфли,Продам новые туфли фирмы Louisa Peeress 37р,1000.0,11,2017-03-17,Company,8cb74742e39236fb3fa232950876f63324cc79ad3dbc496a65d4da8de204cbd3,435.0,0.0
078d07e4548b,442d45274b6a,Челябинская область,Челябинск,Личные вещи,Детская одежда и обувь,Для мальчиков,Брюки,134-140 см (8-10 лет),Брюки джинсовые,Длина по боковому шву=88см. Обхват талии= 66см(регулируется). Обхват бедер=86см. Находимся на северо-востоке.,300.0,65,2017-03-23,Private,ca858c5e60e383a5f0129782f04caa16767fc1060f88698e1d9af97572e11b23,658.0,0.0
b865b1ea7621,88f1d2bb3f11,Ханты-Мансийский АО,Пойковский,Личные вещи,Детская одежда и обувь,Для мальчиков,Комбинезоны и боди,74-80 см (7-12 мес),Летний комбинезончик. новый,"Продам. Новый. Нейтральный цвет. Подойдёт как для девочки, так и для мальчика. Написано 12 мес. Маломерит. Мы быстро выросли и не успели одеть.",500.0,13,2017-03-28,Private,d1a73a4bf5bb768660deebfb8c672ecaae4863d45c39a138282ab29496aa7307,42.0,0.0
208faac9e776,faac0b8d3f16,Пермский край,Пермь,Личные вещи,Детская одежда и обувь,Для девочек,"Шапки, варежки, шарфы",,Шлем киват kivat,"Шлем киват после одного ребёнка, дочка родилась зимой мы носили с рождения и ещё на следующей год носили. Очень тёплый, и удобный. Размер 0. Состояние хорошее, но видно что активно носили)) все мои дети ходят в шлемах kivat, хотя мной было перепробовано множество других шлемов и шапок, если думаете что одевать малышке которая рождается осенью или зимой, смело берите такой шлем, никакой дополнительной поддевы и чепчиков одевать не надо будет и нет завязок, которые так сильно нервируют малышей))",500.0,74,2017-03-15,Private,0947c987a847ff05474be155fbf47639625474f9b6481cf6f57b05a4917cfe5c,104.0,0.0
50ac2bb95f8d,36b6070caad9,Волгоградская область,Волгоград,Личные вещи,"Одежда, обувь, аксессуары",Мужская одежда,Трикотаж и футболки,44–46 (S),Футболка Adidas (хорошее состояние),"В хорошем состоянии футболка Adidas, оригинал, про-во Тайланд, чистая, немного б\у, подойдет на размер 44-46",400.0,2062,2017-03-15,Company,c8b120be7d1c66cb99d17b111f352c8160ef512e5cb49611eb506ea2b0e6928a,632.0,0.1184
745d124338ae,ffed6acdf3cb,Красноярский край,Красноярск,Недвижимость,Квартиры,Продам,1,Вторичка,"1-к квартира, 44 м², 13/16 эт.","ПВХ, отличное состояние. Парковочное место. Вид на Енисей. Торг./
 /
ag25/
 /
id95299",2300000.0,10714,2017-03-24,Shop,9250037f9daa5733bed530dfe2be278dd7f95ed756c80a96811fc57ad11e3ff8,2218.0,0.03227
75076ea12736,7febd220f4b1,Красноярский край,Красноярск,Для дома и дачи,Посуда и товары для кухни,Товары для кухни,,,"Полка хром, двухярусная",,350.0,13,2017-03-20,Private,9ebba0635d12c9828d75b3278f5f1ef694a6d6520eb1bb48c1f88512756d590d,1663.0,0.0
a58ab9e6a0b1,77e9bdfba1b6,Саратовская область,Саратов,Для дома и дачи,Мебель и интерьер,Текстиль и ковры,,,"Одеяло атласное двуспальное, теплое","Продам 2спальное одеяло: ватное, стеганое, ткань атлас, красного цвета. Чистое. Теплое. Толщина в среднем больше 4 см. Вечное) Просто подарили новое)/
Парк Победы. Уважаемый покупатель, возьмите с собой большой пакет, у меня пакетов таких размеров не осталось.",600.0,204,2017-03-22,Company,5530084ad35a3c79e1e56e21fa3ad38e8986efe53ab28effdf6d828b7c2c1bdc,1419.0,0.0
8c7c7596d7e5,1a4ba0f7ddf6,Красноярский край,Красноярск,Личные вещи,Товары для детей и игрушки,Детская мебель,,,Детский развивающий коврик,,500.0,8,2017-03-17,Private,985dd9d183f40eb4d724f7ac24d0b40a1913024592a18c87887d533ef1f0dd23,882.0,0.15008
16cec7b5dc9d,2f12a7caf4b5,Татарстан,Казань,Личные вещи,Товары для детей и игрушки,Детские коляски,,,Коляска б/у трость,"Продаю коляску-трость б/у в хорошем состоянии. Спинка регулируется, занимает мало места, удобно переносить.",2000.0,28,2017-03-18,Private,42fc9418e87bdbde53008ed166ceff1d278d5b1e31cbbbf8e012004b67f106ad,1002.0,0.80323